cluster-id,takeaways
1,"Tokyo Gas and Tokyu Power are key players in the competitive capital region of Japan. Tokyo Gas is actively pursuing sustainability and renewable energy initiatives, including a demand response service, a partnership with Koganei City for a 'Zero Carbon City' declaration, and a demonstration project in Yokohama City to produce e-methane from sewage resources. The company is also venturing into the floating offshore wind power generation business. Despite these efforts, Osaka Gas has recently surpassed Tokyo Gas in market capitalization. Tokyo Gas is also a significant customer of Whelen and is recognized for its high-dividend stocks."
2,"The discussion primarily revolves around the Obic Seagulls and Tokyo Gas American football game, with a particular focus on the cheerleaders and players. There's also a significant interest in Tokyo Gas's commercials, which are praised for their emotional impact and high production quality. Some users also mention Tokyo Gas in relation to other sports and events, such as baseball and a special 'Tokyo Gas Day' event featuring a live performance by the idol group '=LOVE'. Additionally, there are references to Tokyo Gas in the context of video games and a drama series."
0,"Participants expressed mixed views on Tokyo Electric Power Company and TOKYOGAS. Some praised their reliability and safety, while others criticized their pricing and customer service. There was skepticism towards new power companies, with some users recommending thorough research before switching. Concerns were raised about the complexity of managing electricity and gas from different providers. Some users reported higher bills after switching to new providers. There were also complaints about TOKYOGAS's energy-saving campaign and meter replacement practices. A few users mentioned the benefits of online services for elderly customers."
4,"The discussion primarily revolves around Japanese sports, with a particular focus on baseball and swimming. Keiichi Kimura, a swimmer from Tokyo Gas, is repeatedly highlighted for his gold medal win in the men's 50m freestyle at the Paris Paralympics. The participants also discuss various baseball teams and players, including those from Tokyo Gas, and the Hiroshima Toyo Carp's draft picks for 2022. There's also mention of a virtual weight loss challenge and a high school baseball player discussion from Yamanashi Prefecture, Japan."
5,"The participants expressed a range of concerns and complaints about TOKYOGAS. These include dissatisfaction with the company's advertising language, unexpected inspection visits, and charges for services without prior notification. There were also concerns about the company's association with South Korea and allegations of involvement in a dormitory incident. Some participants reported receiving unsolicited emails from various companies, including TOKYOGAS, causing frustration and fear. However, there were also positive interactions, with one participant thanking TOKYOGAS for providing useful information."
3,"The participants discussed a variety of topics related to Tokyo Gas, including its house cleaning service, appliance efficiency, cooking tips, shoe care, and disaster preparedness. They also mentioned promotional events, such as a collaboration with the Japan Green Tea Center for a Halloween event and a limited-time mattress cleaning service. Some participants shared their personal experiences with Tokyo Gas, including safety inspections and air conditioner cleaning. The conversation also touched on Tokyo Gas's radio commercials and their impact on household behaviors."
